{
  "schema_version": "2.0",
  "template_id": "cover_letter_private_v1",
  "tier": 2,
  "tier_label": "ATS Modern",
  "doc_type": "cover_letter",
  "target_sector": ["technology", "design", "startup", "digital_media", "creative_agency"],
  "region": "AU",
  "placeholder_schema": "PLACEHOLDER_SCHEMA_V2",
  "description": "Private-sector cover letter with a clean, modern voice. Arial throughout with Slate Blue and Teal accents. Whitespace-led single-column layout — no decorative rules. ATS-safe. Six blocks: name_header, contact_info, employer_info, salutation, body_paragraphs, closing.",

  "ats_constraints": {
    "columns": 1,
    "allows_tables": false,
    "allows_images": false,
    "allows_text_boxes": false,
    "allows_headers_footers": false,
    "font_family": "Arial",
    "content_layer": "body_only",
    "forbidden_glyphs": ["•", "✔", "★", "❖", "●", "✅", "❌", "|"]
  },

  "palette": {
    "slate_blue": "#4A5568",
    "dark_grey": "#2D3748",
    "teal_accent": "#38B2AC",
    "teal_light": "#E6FFFA",
    "body_text": "#2D3748",
    "muted_text": "#718096",
    "off_white": "#FAFAFA",
    "white": "#FFFFFF"
  },

  "typography": {
    "base_font": "Arial",
    "base_size_pt": 10.5,
    "line_spacing": 1.3,
    "spacing_after_pt": 8,
    "section_heading_tracking_pt": 0,
    "section_heading_size_pt": 13
  },

  "page": {
    "margin_top_cm": 2.0,
    "margin_bottom_cm": 2.0,
    "margin_left_cm": 2.3,
    "margin_right_cm": 2.3,
    "background_color": "#FAFAFA"
  },

  "blocks": [
    {
      "block_id": "name_header",
      "type": "name_block",
      "order": 1,
      "tokens": ["{{CONTACT_NAME}}"],
      "content": "{{CONTACT_NAME}}",
      "visualConfig": {
        "font_size_pt": 18,
        "font_weight": "bold",
        "font_color": "#38B2AC",
        "text_align": "left",
        "padding_top_pt": 0,
        "padding_bottom_pt": 2,
        "letter_spacing": "normal"
      }
    },

    {
      "block_id": "contact_info",
      "type": "contact_block",
      "order": 2,
      "tokens": [
        "{{CONTACT_PHONE}}",
        "{{CONTACT_EMAIL}}",
        "{{CONTACT_LOCATION}}"
      ],
      "content": "{{CONTACT_PHONE}}    {{CONTACT_EMAIL}}    {{CONTACT_LOCATION}}",
      "visualConfig": {
        "font_size_pt": 9,
        "font_color": "#718096",
        "text_align": "left",
        "padding_top_pt": 3,
        "padding_bottom_pt": 20,
        "line_spacing": 1.2,
        "separator": "inline_spaced"
      }
    },

    {
      "block_id": "employer_info",
      "type": "employer_block",
      "order": 3,
      "tokens": [
        "{{EMPLOYER_CONTACT_NAME}}",
        "{{EMPLOYER_ORG}}",
        "{{EMPLOYER_ADDRESS}}"
      ],
      "content": "{{EMPLOYER_CONTACT_NAME}}\n{{EMPLOYER_ORG}}\n{{EMPLOYER_ADDRESS}}",
      "visualConfig": {
        "font_size_pt": 10.5,
        "font_color": "#2D3748",
        "text_align": "left",
        "line_spacing": 1.25,
        "margin_bottom_pt": 16,
        "separator": "line_break"
      }
    },

    {
      "block_id": "salutation",
      "type": "salutation_block",
      "order": 4,
      "tokens": [
        "{{CURRENT_DATE}}",
        "{{SALUTATION}}"
      ],
      "content": "{{CURRENT_DATE}}\n\n{{SALUTATION}}",
      "visualConfig": {
        "font_size_pt": 10.5,
        "font_color": "#2D3748",
        "text_align": "left",
        "line_spacing": 1.25,
        "margin_bottom_pt": 12
      }
    },

    {
      "block_id": "body_paragraphs",
      "type": "body_block",
      "order": 5,
      "tokens": [
        "{{HOOK_PARAGRAPH}}",
        "{{BRIDGE_PARAGRAPH}}",
        "{{EVIDENCE_PARAGRAPH_1}}",
        "{{EVIDENCE_PARAGRAPH_2}}"
      ],
      "content": "{{HOOK_PARAGRAPH}}\n\n{{BRIDGE_PARAGRAPH}}\n\n{{EVIDENCE_PARAGRAPH_1}}\n\n{{EVIDENCE_PARAGRAPH_2}}",
      "visualConfig": {
        "font_size_pt": 10.5,
        "font_color": "#2D3748",
        "text_align": "left",
        "line_spacing": 1.4,
        "paragraph_spacing_after_pt": 12
      }
    },

    {
      "block_id": "closing",
      "type": "closing_block",
      "order": 6,
      "tokens": [
        "{{CLOSING_PARAGRAPH}}"
      ],
      "content": "{{CLOSING_PARAGRAPH}}",
      "visualConfig": {
        "font_size_pt": 10.5,
        "font_color": "#2D3748",
        "text_align": "left",
        "line_spacing": 1.4,
        "margin_top_pt": 8
      }
    }
  ]
}
